"Type","Title/Subject","Content","CTA","Channel","Status"
"LinkedIn Post","Post 1: Facilities managers delete generic cleaning emails","Facilities managers delete generic cleaning emails in seconds.

Most commercial cleaning outreach sounds identical. Facilities managers respond to consistency, accountability, and clear reporting.

CleanReach helps facilities teams reduce complaints, improve standards, and remove supplier headaches.

Would a short conversation be worthwhile?","Would a short conversation be worthwhile?","LinkedIn","Generated"
"Blog Article","How Facilities Managers Can Improve Cleaning Contractor Reliability","# How Facilities Managers Can Improve Cleaning Contractor Reliability

Reliable cleaning is essential for every commercial site.

## Why reliability matters

Missed visits, inconsistent standards and poor communication quickly create complaints and extra admin.

CleanReach supports commercial sites with consistent cleaning, clear communication and accountable service delivery....","Book a CleanReach growth strategy call","Blog","Generated"
"Email Newsletter","Why your cold emails get ignored","Most cleaning companies sending cold emails are doing the same thing: a one-line intro, a list of services, and a 'let me know if you're interested.' Then silence.

The problem isn't that office managers don't need cleaning. They do. The problem is that your email looks like the last five they deleted without reading.

Here's what's actually going wrong.

Generic outreach treats every prospect the same. The same template goes to a 50-person accountancy firm and a 200-person logistics company. Neither feels like you're talking to them. Neither replies.

The companies winning recurring office contracts aren't sending more emails. They're sending better ones — targeted by building type, decision-maker role, and a specific reason to reach out now. That specificity builds enough trust to get a reply.

But a reply isn't a contract. That's where most cleaning companies drop the ball.

No follow-up system means warm leads go cold. A prospect who was genuinely interested last Tuesday gets distracted, and you never come back. A consistent follow-up sequence — three to five touchpoints over two to three weeks — keeps you visible without being annoying. That's how interest turns into a booked conversation.

The other thing that's missing is a clear next step. 'Let me know if you're interested' is not a CTA. 'Here's a 15-minute slot to see if we're a good fit' is. Make it easy for them to say yes.

If you're sending cold emails and getting nothing back, the answer isn't to stop. It's to build a system that targets the right contacts, follows up consistently, and earns the conversation.

That's exactly what we help commercial cleaning companies build at CleanReach.","Book a free growth strategy call and we'll show you how to build a cold outreach system that books commercial cleaning contracts — not just sends emails.","Email","Generated"
"GBP Post","Post 1","Reliable office cleaning should not need constant chasing. CleanReach supports facilities managers with consistent commercial cleaning, clear communication, and dependable service standards.","Contact CleanReach to discuss your cleaning requirements.","Google Business Profile","Generated"
"Video Script","LinkedIn Video Script 1","Facilities managers tell us the same thing. Their cleaning contractor starts well but standards slip. Missed visits, inconsistent communication and poor accountability create unnecessary pressure. CleanReach was built to solve this. We provide reliable commercial cleaning, clear reporting and responsive support so you can focus on running your facility instead of chasing contractors. If you would like a review of your current cleaning arrangements, get in touch with CleanReach today.","Book a cleaning review with CleanReach.","Video","Generated"
"Cold Email Angle","Cleaning let you down again?","Most facilities managers need reliable cleaning without constant chasing. Missed visits and poor communication create unnecessary pressure. CleanReach provides consistent commercial cleaning with clear reporting. Would it be worth a quick conversation?","Would it be worth a quick conversation?","Cold Email","Generated"