"Type","Title/Subject","Content","CTA","Channel","Status"
"LinkedIn Post","Post 1: Most commercial cleaning companies don't have a le","Most commercial cleaning companies don't have a lead generation problem. They have a follow-up problem.

Getting a facilities manager to express interest is the easy part.

What kills the contract opportunity is what happens next:

→ No structured follow-up sequence
→ No reason for the prospect to trust you over the incumbent
→ No system converting interest into a booked meeting

Generic leads won't fix this. A consistent outreach and trust-building system will.

The cleaning companies winning recurring office contracts right now aren't outspending competitors. They're out-following-up, out-positioning, and out-converting them with a repeatable sales process built specifically for commercial cleaning.

Book a CleanReach growth strategy call and we'll show you exactly where your pipeline is leaking contracts. Link in the comments.","Book a CleanReach growth strategy call and we'll show you exactly where your pipeline is leaking contracts. Link in the comments.","LinkedIn","Generated"
"Blog Article","Office Cleaning Contract Lead Generation: How to Build a System That Books Sales Calls","# Office Cleaning Contract Lead Generation: How to Build a System That Books Sales Calls

Most commercial cleaning company owners are not short of ambition. They are short of a repeatable system. If your pipeline depends on word of mouth or tender portals everyone else is bidding on, growth feels like luck rather than strategy.

This article shows you how to build a structured cold email system that generates recurring office cleaning contracts — consistently.

## Why Most Cleaning Companies Str...","Book a CleanReach growth strategy call","Blog","Generated"
"Email Newsletter","Why your cold emails aren't winning contracts","Most cleaning companies sending cold emails are doing the same thing: a one-shot message, a generic pitch, and then silence.

That's not lead generation. That's hoping.

Here's what's actually happening on the other side of your emails. The facilities manager or office manager you're targeting receives your message, doesn't have an immediate need, and moves on. Not because they don't care about cleaning. Because the timing wasn't right and nothing pulled them back.

The companies winning commercial contracts consistently aren't sending better first emails. They're building a system that stays in front of prospects until the timing is right.

That means a sequence — not a single email. It means following up three, four, five times across several weeks with messages that add value, not just chase a reply. It means referencing their sector, their building type, their likely pain points. A school has different cleaning pressures to a logistics warehouse. Your outreach should reflect that.

It also means being ready when they do respond. A lead that replies to email four in your sequence is warm. If your follow-up takes 48 hours, or worse, lands in a generic inbox no one monitors, that opportunity is gone.

The businesses we work with don't chase random leads. They build a prospecting engine: targeted lists of the right decision-makers, sequenced outreach that builds familiarity and trust, and a clear path from first reply to booked conversation.

This isn't about volume. Blasting five hundred emails a week and hoping for a 0.5% reply rate is not a growth strategy. Targeting fifty well-researched prospects with a thoughtful, consistent sequence will outperform that every time.

If you're already sending cold emails but not booking enough conversations, the problem is almost certainly not the first message. It's everything that comes after it.

We help commercial cleaning companies build outbound systems that follow up properly, speak to the right people, and turn interest into real sales conversations.","Book a free CleanReach growth strategy call and we'll show you exactly where your current outreach is losing contracts.","Email","Generated"
"GBP Post","Post 1","Struggling to win office cleaning contracts in [CITY]? Reliable contract cleaning services start with the right outreach system — not just a great quote. We help commercial cleaning companies build pipelines that convert.","Book a CleanReach growth strategy call today.","Google Business Profile","Generated"
"Video Script","LinkedIn Video Script 1","","","Video","Generated"
"Cold Email Angle","Losing bids to bigger cleaners?","Hi [First Name],

Most cleaning companies in [City] send quotes and never hear back.

No follow-up system means warm leads go cold — and contracts go to whoever shows up twice.

At CleanReach, we build outbound and follow-up systems specifically for commercial cleaning companies targeting [Industry] clients like [Company].

Worth a 20-minute call to see if it fits?","Worth a 20-minute call to see if it fits?","Cold Email","Generated"