"Type","Title/Subject","Content","CTA","Channel","Status"
"LinkedIn Post","Post 1: ","","","LinkedIn","Generated"
"Blog Article","How to Generate Office Cleaning Contracts With Cold Email (A System That Actually Works)","# How to Generate Office Cleaning Contracts With Cold Email (A System That Actually Works)

Most commercial cleaning companies are sitting on real capacity — the staff, the equipment, the experience — but their pipeline looks like a graveyard. One or two anchor clients, a handful of one-offs, and a lot of hoping the phone rings.

The problem is not the quality of your service. The problem is the absence of a repeatable system to put your business in front of the right decision-makers, build enou...","Book a CleanReach growth strategy call","Blog","Generated"
"Email Newsletter","Why your cold emails aren't booking meetings","Most cleaning companies sending cold emails make the same mistake. They send one email, get no reply, and assume the prospect isn't interested. Then they move on and start the whole thing over with someone new.

That's not a lead generation system. That's a guessing game.

Here's what's actually happening: office managers and facilities contacts receive dozens of supplier emails every week. A single cold email, no matter how well-written, rarely converts on its own. Not because they don't need cleaning. Because they don't know you yet.

Trust is built through consistency. A prospect who ignores your first email might reply to your third — if your follow-up adds something useful instead of just asking again. A short sequence that includes a relevant insight, a social proof point, and a low-friction ask will outperform a single clever email every time.

The other problem is what happens when someone does show interest. A lot of cleaning businesses get a reply, send over a generic brochure, and then wait. The prospect goes cold. That initial interest had a short window, and waiting killed it. Your follow-up process needs to be as tight as your outreach.

What a working cold email system actually looks like:

— A targeted list of decision-makers at local office buildings, managed workspaces, and commercial properties
— A 4 to 5 step email sequence with clear gaps between each touchpoint
— Replies handled quickly, with a clear next step that leads to a booked conversation
— Consistent weekly sending so your pipeline doesn't run dry between contracts

This isn't about sending more emails. It's about building a repeatable process that creates predictable conversations with the right people — week in, week out.

If your current approach relies on word of mouth or the occasional tender, a cold email system gives you control over where your next contract comes from. That's the difference between reacting to opportunities and building a pipeline.

If you want to see how this works in practice for commercial cleaning companies, book a strategy call with the CleanReach team.","Book your free CleanReach growth strategy call and we'll map out a cold email system built around your target contracts.","Email","Generated"
"GBP Post","Post 1","Struggling to fill your contract pipeline? Our office cleaning contractors in [CITY] deliver consistent, scheduled cleans that facilities managers rely on. No missed visits. No chasing. Just reliable commercial cleaning that renews.","Book a CleanReach growth strategy call","Google Business Profile","Generated"
"Video Script","LinkedIn Video Script 1","Your cold emails aren't failing because of your price. They're failing because there's no system behind them. Most owners send a few emails, get no reply, and give up. But here's what actually works — send a short, specific email that speaks to their building and their problem. Then follow up consistently. Most commercial contracts are won on follow-up four, five, or six. Cleaning companies using this sequence are closing recurring office contracts worth four to ten thousand a year. Want the exact sequence? Book a free CleanReach growth strategy call — link's in the comments.","Book a free CleanReach growth strategy call. Link is in the comments. We'll map out your outreach sequence in 30 minutes.","Video","Generated"
"Cold Email Angle","Cleaning contracts in [City]","Hi [First Name],

Most [Industry] facilities in [City] switch cleaning providers after months of chasing missed cleans.

If you're looking to lock in reliable, long-term contracts — rather than chasing one-off jobs — we help cleaning companies build outreach systems that reach the right decision-makers consistently.

[Company] could have a steady pipeline of qualified office leads within 30 days.

Worth a 20-minute call this week?","Worth a 20-minute call this week?","Cold Email","Generated"