"Type","Title/Subject","Content","CTA","Channel","Status"
"LinkedIn Post","Post 1: ","undefined

undefined

undefined","","LinkedIn","Generated"
"Blog Article","How to Generate Office Cleaning Contracts with Cold Email (A System That Actually Works)","# How to Generate Office Cleaning Contracts with Cold Email (A System That Actually Works)

Most commercial cleaning companies are losing contracts they should be winning — not because their service is poor, but because their pipeline is unpredictable. One month is busy. The next is quiet. New contracts come from referrals or luck, not from a repeatable system.

If you want recurring office cleaning contracts — the kind that pay monthly, renew annually, and underpin your entire business — you ne...","Book a CleanReach growth strategy call","Blog","Generated"
"Email Newsletter","Why cold leads don't turn into contracts","Most cleaning companies chasing office contracts have the same problem — and it's not a lack of leads.

They get a few replies. Someone asks for a quote. Then nothing. The prospect goes cold and the opportunity disappears.

Here's what's actually happening.

Office managers and facilities buyers don't switch cleaning contractors on impulse. They have existing suppliers, inertia works against you, and they're not going to hand over a recurring contract to a company they've heard from once. Trust takes repetition. One cold email isn't a system — it's a shot in the dark.

The cleaning companies consistently winning office contracts aren't sending better emails. They're following up more deliberately. A sequence that starts with a specific, relevant outreach message — not a generic ""we clean offices"" pitch — and then follows up two, three, four times over several weeks. Each touchpoint adds a small amount of credibility. A case study. A relevant question. A short proof point.

By the time the prospect replies, they already feel like they know you.

There's a second piece most companies miss: timing. Office cleaning contracts often become available when something goes wrong — a current supplier lets them down, a lease renewal triggers a procurement review, headcount changes. Your job is to be in front of the right prospects consistently enough that when that moment arrives, you're the name they remember.

That only happens if you have a pipeline that runs every week — not a burst of outreach every time you need new business.

If your current approach to winning office contracts looks like occasional outreach, sporadic follow-up, and waiting for referrals, you don't have a lead generation system. You have a hope strategy.

Building a predictable pipeline for commercial contracts isn't complicated. But it does require the right sequences, the right targeting, and consistent execution — week in, week out.","Book a free CleanReach growth strategy call and we'll show you exactly how to build a cold outreach system that turns office prospects into booked conversations.","Email","Generated"
"GBP Post","Post 1","Struggling to fill your contract pipeline? Our office cleaning contractors in [CITY] deliver consistent, accountable service that facilities managers trust. Regular office cleaning contracts start with one conversation.","Book a CleanReach growth strategy call","Google Business Profile","Generated"
"Video Script","LinkedIn Video Script 1","","","Video","Generated"
"Cold Email Angle","Cleaning contracts in [City]","Hi [First Name],

Most [Industry] facilities in [City] switch cleaners due to inconsistent standards — not price.

If [Company] is looking for a reliable commercial cleaning partner, we work with offices your size and can have someone with you within 48 hours.

Would it be worth a quick call to see if we're a fit?

[Your Name]","Worth a 15-minute call this week?","Cold Email","Generated"