"Type","Title/Subject","Content","CTA","Channel","Status"
"LinkedIn Post","Post 1: Facilities managers delete generic cleaning emails","Facilities managers delete generic cleaning emails in seconds.

Most commercial cleaning outreach sounds identical. Facilities managers respond to consistency, accountability, and clear reporting.

CleanReach helps facilities teams reduce complaints, improve standards, and remove supplier headaches.

Would a short conversation be worthwhile?","Would a short conversation be worthwhile?","LinkedIn","Generated"
"Blog Article","How Facilities Managers Can Improve Cleaning Contractor Reliability","# How Facilities Managers Can Improve Cleaning Contractor Reliability

Reliable cleaning is essential for every commercial site.

## Why reliability matters

Missed visits, inconsistent standards and poor communication quickly create complaints and extra admin.

CleanReach supports commercial sites with consistent cleaning, clear communication and accountable service delivery....","Book a free cold email strategy call at api.leadconnectorhq.com/widget/bookings/call-with-cleanreach","Blog","Generated"
"Email Newsletter","Why FMs ignore your cold emails","Most cold emails cleaning companies send get deleted in under three seconds.

Not because the service is bad. Because the email looks like it was written for anyone — which means it feels relevant to no one.

Facilities managers receive outreach constantly. What makes them stop and read? When something in the first two lines reflects their world. Their building type. Their sector. A problem specific to their setup.

Generic pitch: ""We provide professional commercial cleaning services to businesses across the region.""

Specific pitch: ""We work with mid-size office buildings in the 10,000–30,000 sq ft range — typically doing 3x weekly cleans. If your current contractor is inconsistent on early-morning attendance, that's exactly the gap we help close.""

One of those gets a reply. The other gets archived.

The approach that consistently works is a 3-email sequence built around three things: the prospect's industry, their likely building size, and their cleaning frequency. That level of specificity signals that you've done five minutes of research — and that alone separates you from 95% of the outreach they receive.

Sequence structure that works:

Email 1 — Short intro referencing their sector and a common pain point (e.g., compliance requirements in healthcare, footfall pressure in education).

Email 2 — Sent 4 days later. One sentence acknowledging they're busy, followed by a single relevant proof point (a client result, a retained contract length, a specific location).

Email 3 — Sent 5 days after that. A low-friction close: ""Not the right time?"" or ""Happy to send over what we'd typically propose for a building your size?""

This sequence converts at 3–5x the rate of a single generic email. Not because it's clever — because it's relevant.

If you want to build this sequence for your own target list of FMs, we can map it out with you on a free strategy call.","Book your free cold email strategy call — we'll build the sequence framework with you: api.leadconnectorhq.com/widget/bookings/call-with-cleanreach","Email","Generated"
"GBP Post","Post 1","Reliable office cleaning should not need constant chasing. CleanReach supports facilities managers with consistent commercial cleaning, clear communication, and dependable service standards.","Contact CleanReach to discuss your cleaning requirements.","Google Business Profile","Generated"
"Video Script","LinkedIn Video Script 1","Facilities managers tell us the same thing. Their cleaning contractor starts well but standards slip. Missed visits, inconsistent communication and poor accountability create unnecessary pressure. CleanReach was built to solve this. We provide reliable commercial cleaning, clear reporting and responsive support so you can focus on running your facility instead of chasing contractors. If you would like a review of your current cleaning arrangements, get in touch with CleanReach today.","Book a cleaning review with CleanReach.","Video","Generated"
"Cold Email Angle","Cleaning let you down again?","Most facilities managers need reliable cleaning without constant chasing. Missed visits and poor communication create unnecessary pressure. CleanReach provides consistent commercial cleaning with clear reporting. Would it be worth a quick conversation?","Would it be worth a quick conversation?","Cold Email","Generated"