"Type","Title/Subject","Content","CTA","Channel","Status"
"LinkedIn Post","Post 1: Most commercial cleaning companies don't have a le","Most commercial cleaning companies don't have a lead generation problem. They have a follow-up and trust problem.

Getting a facilities manager to reply is the easy part.

What kills most cleaning companies is what happens after that first contact.

No structured follow-up. No authority-building touchpoints. No system that keeps you front of mind until they're ready to move.

So the lead goes cold. The contract goes to a competitor who stayed consistent.

The cleaning companies winning recurring office contracts aren't chasing more leads. They're running a system that builds credibility, follows up with purpose, and converts interest into booked sales conversations.

That's the difference between a pipeline and a wishlist.

If you want a contract acquisition system that actually converts, book a CleanReach growth strategy call. Link in the comments.","If you want a contract acquisition system that actually converts, book a CleanReach growth strategy call. Link in the comments.","LinkedIn","Generated"
"Blog Article","How to Generate Office Cleaning Contract Leads With Cold Email","# How to Generate Office Cleaning Contract Leads With Cold Email

Most commercial cleaning companies are not losing contracts because their cleaning is poor. They are losing because their pipeline is empty. Cold email, done correctly, is one of the most scalable ways to generate office cleaning contract leads — not bulk email, but a structured system that targets decision-makers and moves them toward a sales conversation.

## Why Cold Email Works for Office Cleaning Lead Generation

Office clean...","Book a CleanReach growth strategy call","Blog","Generated"
"Email Newsletter","Why your cold emails aren't winning contracts","Most cleaning company owners we speak to have tried cold email. Some paid for a list. Some sent a few hundred emails. A handful got replies. Almost none turned those replies into signed contracts.

The problem isn't the email. It's what happens after.

Cold outreach for commercial cleaning contracts doesn't fail at the first touch. It fails because there's no system behind it. One email goes out, silence comes back, and the lead gets forgotten. Meanwhile, a competitor with a slower pitch but a smarter follow-up sequence wins the contract.

Here's the insight most cleaning business owners miss: facilities managers and office managers are not waiting to be sold to. They're busy, they already have a cleaner, and they're not actively looking to switch. Your job isn't to interrupt them with a pitch — it's to stay visible, build familiarity, and be the obvious choice when their current contract frustrates them.

That requires a system, not a one-off send.

A working cold email system for commercial cleaning contracts has three parts. First, a targeted outreach sequence — not one email, but a structured series of four to six touchpoints spread over three to four weeks. Second, a reason to reply that isn't just 'we're a great cleaning company' — it's a specific, relevant observation about their sector, location, or situation. Third, a clear next step that feels low-friction, like a short conversation rather than a full proposal.

When those three things work together, cold email stops being a lottery and becomes a predictable pipeline.

We help commercial cleaning companies build exactly this. Not a batch-and-blast campaign, but a repeatable outbound system that generates booked sales conversations with the right facilities managers, property managers, and office decision-makers — consistently.

If your current outreach isn't producing conversations, the fix isn't more volume. It's better structure.","Book a free CleanReach growth strategy call and we'll show you what a contract-winning cold email system looks like for your business.","Email","Generated"
"GBP Post","Post 1","Tired of chasing one-off jobs? Regular office cleaning contracts mean predictable revenue. We help commercial cleaning companies in [CITY] build pipelines that convert — not just quote and hope.","Book a CleanReach growth strategy call","Google Business Profile","Generated"
"Video Script","LinkedIn Video Script 1","","","Video","Generated"
"Cold Email Angle","More office contracts, [City]","Hi [First Name],

Most cleaning companies in [City] lose contracts not because of their service — but because their follow-up falls apart.

At CleanReach, we build outbound systems that help cleaning companies generate office leads and turn them into booked sales conversations — consistently.

Worth a 20-minute call to see if it's a fit for [Company]?","Worth a 20-minute call to see if it fits?","Cold Email","Generated"