"Type","Title/Subject","Content","CTA","Channel","Status"
"LinkedIn Post","Post 1: ","","","LinkedIn","Generated"
"Blog Article","How to Generate Office Cleaning Contracts with Cold Email (A System That Actually Works)","# How to Generate Office Cleaning Contracts with Cold Email (A System That Actually Works)

Most commercial cleaning company owners have tried cold email at some point. They sent a batch of messages, got a handful of replies, won nothing, and concluded that cold email does not work. The real problem is not the channel — it is the absence of a system.

Generating office cleaning contracts through cold outreach is not about blasting inboxes with a generic pitch. It is about identifying the right f...","Book a CleanReach growth strategy call","Blog","Generated"
"Email Newsletter","Why your cold emails aren't converting","Most cleaning companies chasing office contracts make the same mistake. They send one cold email, get no reply, and assume the prospect isn't interested.

That's not how decisions get made.

Facility managers and office directors are busy. They're not ignoring you because they don't need cleaning. They're ignoring you because you haven't given them enough reason to stop and respond — yet.

Here's the real problem: a single cold email isn't a system. It's a shot in the dark. What actually wins recurring office contracts is a sequence that builds familiarity, addresses objections, and keeps your name visible until the timing is right.

That means following up. Not once. Three, four, sometimes five times — across email and LinkedIn — over three to four weeks. Each touchpoint should add something: a relevant observation about their building type, a result you've achieved for a similar client, a low-friction offer like a free site audit.

The companies consistently winning office contracts aren't necessarily the best cleaners. They're the ones with the most consistent outreach process. They show up repeatedly, professionally, and with a clear reason to respond.

There's also a targeting problem worth fixing. Generic prospect lists waste your time. A focused list of 50 decision-makers in your local commercial market — office managers, property managers, estate agents managing commercial space — will outperform a spray-and-pray list of 500 every time.

And when someone does reply? That's where most owners drop the ball. No follow-up process, no booked call, no proposal. The lead goes cold because there's no system on the back end to convert interest into a signed contract.

Building this kind of pipeline isn't complicated. But it does require consistency, the right messaging, and a process that doesn't depend on you remembering to follow up.

If your current outreach isn't producing regular booked calls with office prospects, it's worth looking at the system — not just the email.","Book a free CleanReach growth strategy call and we'll review your current outreach and show you exactly where contracts are being left on the table.","Email","Generated"
"GBP Post","Post 1","Struggling to fill your schedule with reliable office cleaning contracts? We help [CITY] cleaning companies build consistent pipelines of commercial clients — not one-off jobs. Regular office cleaning contracts mean predictable revenue, every month.","Book a CleanReach growth strategy call at cleanreach.co.uk","Google Business Profile","Generated"
"Video Script","LinkedIn Video Script 1","","","Video","Generated"
"Cold Email Angle","Cleaning contracts in [City]","Hi [First Name],

Most [Industry] facilities managers in [City] tell us the same thing — their cleaner was great at the pitch, then standards dropped.

At [Company], you deserve a contractor who stays consistent and checks in proactively.

We work with cleaning companies to build exactly that reputation before they ever send a proposal.

Worth a quick 15-minute call this week to see if it fits?","Worth a 15-minute call this week?","Cold Email","Generated"