"Type","Title/Subject","Content","CTA","Channel","Status"
"LinkedIn Post","Post 1: Most commercial cleaning companies don't have a le","Most commercial cleaning companies don't have a lead generation problem. They have a follow-up problem.

Getting a facilities manager to open your email is the easy part.

What kills most cleaning companies' pipelines:

→ No consistent follow-up sequence
→ Leads go cold after one call
→ No system to build trust before the meeting

The cleaning companies winning recurring office contracts aren't sending more cold emails.

They're running a system that nurtures decision-makers over weeks, builds credibility at every touchpoint, and converts interest into booked sales conversations.

One touchpoint doesn't win contracts. A system does.

Want to see how CleanReach builds that system for commercial cleaning companies? Book a growth strategy call today — link in the comments.","Want to see how CleanReach builds that system for commercial cleaning companies? Book a growth strategy call today — link in the comments.","LinkedIn","Generated"
"Blog Article","Office Cleaning Contract Lead Generation: How to Build a System That Actually Wins Recurring Contracts","# Office Cleaning Contract Lead Generation: How to Build a System That Actually Wins Recurring Contracts

Most commercial cleaning companies do not have a lead generation problem. They have a system problem. Enquiries come in sporadically. Follow-up is inconsistent. Promising conversations go cold. This article shows you how to build a cold email system that wins recurring office cleaning contracts — not one-off jobs, not referrals you cannot scale.

## Why Most Cleaning Companies Struggle to Ge...","Book a CleanReach growth strategy call","Blog","Generated"
"Email Newsletter","Why your cold emails aren't winning contracts","Most commercial cleaning companies chasing office contracts have the same frustration: they send emails, maybe make a few calls, and then hear nothing back.

So they buy more leads. Or try a different list. Or give up on outreach entirely.

The problem isn't the leads. It's the absence of a system behind them.

Here's what actually happens when a facilities manager or office contact receives a cold email from a cleaning company: they might be mildly interested, but they're not ready to switch suppliers today. They file it away mentally, or delete it, and move on. Without a follow-up sequence, that's the end of the conversation.

Research consistently shows that most B2B decisions require between five and eight touchpoints before a meeting is booked. Most cleaning companies stop at one or two. The companies winning contracts aren't necessarily sending better cold emails — they're following up when their competitors have already gone quiet.

This is where a cold email system changes the outcome. Not a one-off blast, but a structured sequence: an opening email that speaks directly to the prospect's situation, followed by a short follow-up that adds value, then a soft check-in that keeps the door open. Each message builds familiarity without pressure.

The goal isn't to hard-sell a cleaning contract on the first email. The goal is to earn enough attention to get a conversation. From there, your sales process takes over.

There's one more piece that most cleaning companies miss: consistency. A system only works if it runs every week, not just when someone has spare time. The cleaning companies generating a predictable flow of new contract opportunities have taken outreach out of the to-do list and made it a repeatable process.

If your current approach to office contract lead generation is sporadic, or relies entirely on referrals and renewals, this is the gap worth closing first.

The good news is that a well-built cold email system doesn't require a big team or a large budget. It requires the right targeting, the right messaging, and the discipline to follow up.","Book a CleanReach growth strategy call and we'll show you exactly how to build a cold outreach system that turns interest into booked sales conversations.","Email","Generated"
"GBP Post","Post 1","Struggling to win consistent office cleaning contracts in [CITY]? Regular office cleaning clients want reliability — not just a quote. We help commercial cleaning companies build systems that turn cold prospects into signed contracts.","Book a CleanReach growth strategy call today.","Google Business Profile","Generated"
"Video Script","LinkedIn Video Script 1","","","Video","Generated"
"Cold Email Angle","More office contracts in [City]","Hi [First Name],

Most cleaning companies in [City] lose contracts not on quality — but on follow-up.

If your pipeline feels unpredictable or your outreach has stalled, that's the gap we fix.

CleanReach builds contract acquisition systems for commercial cleaning companies — cold outreach, follow-up sequences, and sales conversations that convert.

Worth a 20-minute call this week?","Worth a 20-minute call to see if it fits your pipeline goals?","Cold Email","Generated"